{
  "schema_version": "1.0",
  "figure_id": "mechanism",
  "nodes": [
    {
      "node_id": "receptor",
      "node_type": "image_asset",
      "asset_id": "receptor",
      "panel_id": "a",
      "bbox": [0.1, 0.2, 0.3, 0.5]
    }
  ],
  "ports": [
    {"port_id": "receptor-out", "node_id": "receptor", "side": "right"}
  ],
  "typed_edges": [],
  "groups": [],
  "labels": [],
  "constraints": []
}
